{
  "$schema": "https://json-schema.org/draft/2020-12/schema",
  "$id": "gu://schemas/representation_content.schema.json",
  "title": "RepresentationContentRecord",
  "description": "Records a structural representation content check for a candidate (M50). Written as representation_content.json by build-phase5-sidecars (P6-M3).",
  "type": "array",
  "items": {
    "type": "object",
    "required": [
      "recordId",
      "candidateId",
      "expectedModeCount",
      "observedModeCount",
      "consistent"
    ],
    "properties": {
      "recordId": {
        "type": "string",
        "description": "Identifier for this record."
      },
      "candidateId": {
        "type": "string",
        "description": "Candidate or particle ID being checked."
      },
      "expectedModeCount": {
        "type": "integer",
        "description": "Expected number of modes for this representation.",
        "minimum": 0
      },
      "observedModeCount": {
        "type": "integer",
        "description": "Observed number of modes in the spectrum.",
        "minimum": 0
      },
      "missingRequiredCount": {
        "type": "integer",
        "description": "Number of required representation content items that are absent. Triggers Fatal falsifier when > 0.",
        "minimum": 0
      },
      "structuralMismatchScore": {
        "type": "number",
        "description": "Structural mismatch score (0-1). Triggers High falsifier when > RepresentationContentThreshold.",
        "minimum": 0,
        "maximum": 1
      },
      "consistent": {
        "type": "boolean",
        "description": "Whether the mode count is consistent with the expected representation."
      },
      "inconsistencyDescription": {
        "type": ["string", "null"],
        "description": "Optional description of the inconsistency."
      },
      "origin": {
        "type": "string",
        "description": "Origin classification for this sidecar record.",
        "enum": ["upstream-sourced", "bridge-derived", "heuristic"]
      },
      "sourceArtifactRefs": {
        "type": ["array", "null"],
        "description": "Artifact references used to support this record.",
        "items": { "type": "string" }
      },
      "provenance": {
        "type": ["object", "null"],
        "description": "Provenance of the backend that produced this record."
      },
      "p11StabilizationNote": {
        "type": ["string", "null"],
        "description": "Phase XI P11-M5 stabilization note. Non-null when this record has been examined in Phase XI and the representation-content fatal is a stable scientific limitation that cannot be closed in the current repository context."
      }
    },
    "additionalProperties": false
  }
}
